text,intent
Change accent to male british?,change_accent
Set to female voice?,change_accent
Please change accent to british male?,change_accent
Please set to female voice?,change_accent
Use male voice?,change_accent
Can you switch to female voice?,change_accent
Please use male voice?,change_accent
Switch to female voice?,change_accent
Can you use male voice?,change_accent
Use male voice now?,change_accent
Can you make your accent british male?,change_accent
Now use male voice?,change_accent
Speak as a british male?,change_accent
Change accent to british male?,change_accent
Change to female voice?,change_accent
Use the male voice please?,change_accent
Can you swap to male voice?,change_accent
I want to change to male voice?,change_accent
Use female voice now instead?,change_accent
Please start using female voice?,change_accent
I want to use the female voice now?,change_accent
I prefer female voice now?,change_accent
Switch from the male to the female voice?,change_accent
Please use male voice instead?,change_accent
Switch over from female to the male voice?,change_accent
I need a new accent male british?,change_accent
Switch to male british accent?,change_accent
Where can i locate my w2 so i can do my taxes?,w2
Where is the w-2 form located?,w2
Where can i locate my w-2 form?,w2
Where can one receive their w-2 form?,w2
What is the location of my w2 that is needed for taxes?,w2
Where would my w2 be found so i can do my taxes?,w2
I need to find my w2 so i can do taxes?,w2
Where are w-2 forms given?,w2
I require my w2 for taxes and need to locate it?,w2
Where do i get the form i need for taxes?,w2
How can i get my year end summary for taxes?,w2
Where should i go to get a w2 to do my taxes?,w2
Where do i pick up a w2 form?,w2
Where can i get a w2 form?,w2
Tell me where a w2 is available please?,w2
A w2 form can be gotten from where?,w2
Can i get a w2 form online?,w2
Help me get a w2 to do my taxes?,w2
What location can i get a w2 from?,w2
Where can i get a w2?,w2
A w2 form is obtainable where?,w2
Who can send me a w2 so i can complete my taxes?,w2
How can i get my w2 to do my taxes?,w2
Where can i pick up my w2 to do my taxes?,w2
Where do i get the form that shows my wages for the year for taxes?,w2
Can you tell me what the form is employers are supposed to send you for taxes and where i get it?,w2
I've got tax issues and need help obtaining my w2?,w2
I need to do taxes and have to get a w2?,w2
Where do i find the irs form that tells me the amount of money i owe them?,w2
Where do i get the tax form that i have to report to the irs?,w2
Can you locate my w-2?,w2
I would like to know how to find my w-2?,w2
Can you help me find my w-2?,w2
"Hey, anyone seen my w-2?",w2
Help - i can't find my w-2?,w2
Where is my w-2?,w2
Where can i get my w-2?,w2
I need to download my w-2 form?,w2
Can you access my w-2?,w2
How can i get a hold of my w-2?,w2
I need to get a hold of my w-2 right now?,w2
Where can i get the form i need to do my taxes?,w2
"Where can i get the form i need to do my taxes, please?",w2
"Where can i get the employment document that i need to do my taxes, please?",w2
Where can i get a w2 form from?,w2
Where can i obtain a w2 form?,w2
Where can i find a w2 form?,w2
Where can i obtain a w2 form from?,w2
Where can i get the employment form i need to do my taxes?,w2
"Where can i get the employment form i need to do my taxes, please?",w2
Where is my w2?,w2
Where can i find my w2?,w2
Where can i find my w2 as i need it for tax reasons?,w2
Where do i get my tax papers?,w2
Where do i recieve a w2?,w2
How do i get a w2?,w2
Is this where i get a w2?,w2
Can you tell me where to get a w2?,w2
Who has the tax form that shows my wages?,w2
What is that tax form that shows my wages and where do i get it?,w2
Where do i locate the form that has my tax information?,w2
Who has the tax form that has my wage informaton?,w2
Where do i get the tax form that shows my wages?,w2
Where's my w-2?,w2
I can't find my w-2?,w2
Do you know where my w-2 is?,w2
I'm having trouble locating my w-2?,w2
Where can i find my w-2?,w2
Provide me assistance on where to go to get my w2 for tax reasons?,w2
I am in need of my w2 for tax reasons; provide me where to get it?,w2
Assist me on where to go to get my w2 for tax reasons?,w2
Where do i go to get my w2 for tax reasons?,w2
Where can i get my w2 from for tax reasons?,w2
I would like to get the forms to file for my w2?,w2
Where could i locate a w2 form from?,w2
Locate my w-2 form?,w2
Where could i find forms to get my w2?,w2
Where can i find my tax form to report what i earn?,w2
Where do i go to get my w-2?,w2
How do i find my w-2 form?,w2
What is the form i need to report my earnings?,w2
Where do i get my w2 form from?,w2
Tell me where to get myy w-2 form?,w2
Where can i find my w-2 form?,w2
Where can i locate a form for my w2?,w2
Is my w2 available at the post office?,w2
I need to know where to get a w-2 form?,w2
When will i receive my w2?,w2
Can i get my w2 online?,w2
How do i get a w-2?,w2
I need help getting a w-2?,w2
Can i get a w-2 from the post office?,w2
Can i get my w-2 online?,w2
Does my w2 come by mail?,w2
How and where are my w2 forms given?,w2
Where can i get my w2 forms from?,w2
From where are w2 forms given?,w2
How do i get a w2 form and from where?,w2
How do i get a personal w2 form?,w2
Have i been sent my w-2 in my email?,w2
When should i pay my bill by?,bill_due
When is my car insurance due?,bill_due
When's the gas bill due?,bill_due
When do i pay the utilities?,bill_due
Do i pay my rent this week?,bill_due
I need to know when i must pay my car bill?,bill_due
How much is my water bill?,bill_due
Is my bill due this week?,bill_due
How much time left to pay my bill?,bill_due
What day is my car insurance due?,bill_due
When's the electric bill due?,bill_due
When's the next phone bill?,bill_due
When is my next car payment?,bill_due
When is too late to pay my cable bill?,bill_due
Can you alert me when my phone bill is due?,bill_due
On what day do i pay my car payment?,bill_due
How can i know when my cable bill is due?,bill_due
What day do i have to pay for my capital one card?,bill_due
How long do i have left to pay for my chase credit card?,bill_due
What is the due date of my att bill?,bill_due
When is my xfinity bill due?,bill_due
How many more days before my verizon bill is due?,bill_due
I cant remember when my bill is due?,bill_due
What is the due date of my bill?,bill_due
What day is my bill due?,bill_due
When is my bill due?,bill_due
Tell me when my bill will be due?,bill_due
How do i locate when my gas bill is do?,bill_due
I would like to know my electric bills date it needs to be payed?,bill_due
I need to know where to locate when my gas bill is due?,bill_due
Can you tell me when my electric bill is due?,bill_due
I need to know the due date for my credit card?,bill_due
Where should i look for when my gas bill is due?,bill_due
Can you tell me the date my credit card is due?,bill_due
I'd like to find the date that my gas bill is due?,bill_due
How do i know when to pay my gas bill?,bill_due
When do i have to pay my water bill by?,bill_due
When do i have to pay my electric bill by?,bill_due
When do i have to pay my internet bill by?,bill_due
When do i have to pay my gas bill by?,bill_due
Tell me when i have to pay my bill?,bill_due
What date do i have to pay my bill?,bill_due
Give me the date my bill is due?,bill_due
On what day do i have to pay my nordstrom bill?,bill_due
When is my chase visa due?,bill_due
When do i need to pay my annual payment for auto insurance?,bill_due
What is the exact due date for my mortgage payment?,bill_due
What is the due date for my metronorth monthy pass?,bill_due
Can you tell me when my peco energy bill is due this month?,bill_due
Please find the exact payment due date for my sprint phone bill?,bill_due
What is the due date on my xfinity internet bill for february?,bill_due
What is the latest date that i can pay my direct tv bill this month?,bill_due
I need the new due date for my pgw gas bill?,bill_due
What time do i have to pay z bill?,bill_due
Whats the due date for z bill?,bill_due
How soon before my catering bill is due?,bill_due
How long before my lawn guy bill's due?,bill_due
When's my heater bill due?,bill_due
What date is my water bill due?,bill_due
Whats the deadline for amex payment?,bill_due
When is my visa due?,bill_due
When is visa due?,bill_due
Do you know when i need to pay my mastercard?,bill_due
What's the due date for my american express payment?,bill_due
When is my mortgage payment due?,bill_due
What's the due date for the credit card?,bill_due
When's the next time i have to pay the insurance?,bill_due
How long do i have to pay the gas bill?,bill_due
When's the rent due?,bill_due
When does the car payment come due?,bill_due
When does the electric bill up?,bill_due
How do i check when my mortgage is next up for payment?,bill_due
When do i owe the state payment for my car tags?,bill_due
When do i owe the rent?,bill_due
Do i need to pay my credit card bill already?,bill_due
Do you know when my next electric bill is due?,bill_due
Where do i find information on when the water bill is due?,bill_due
How do i ascertain when my next insurance payment will be?,bill_due
What do i do to check when my next credit card payment is?,bill_due
When do i need to pay my at&t bill?,bill_due
What is the due date of my at&t bill?,bill_due
Is my at&t bill do soon?,bill_due
When is my at&t bill due?,bill_due
What date is my at&t bill due?,bill_due
When's the ac bill due?,bill_due
What day is the z bill due?,bill_due
What's the due date for the renting bill?,bill_due
I want to know when a bill is due?,bill_due
What day is the bill due?,bill_due
I would like to know when the bill is due?,bill_due
What is the due date for a bill?,bill_due
When is the bill due?,bill_due
How do i find when my water bill needs to be paid?,bill_due
When is my water bill due?,bill_due
How do i find when my cable bill is due?,bill_due
When is my electric bill due?,bill_due
When do i need to pay the water bil?,bill_due
How do i find when my medical bill is due?,bill_due
When do i need to pay the cable bill?,bill_due
How do i find when my electric bill is due?,bill_due
Can you provide me the calories in the smoothie?,calories
Can you tell me the calories for the cheeseburger?,calories
I'd like the calories for this chicken breast?,calories
How many calories in this slice of pizza?,calories
What about the calories for this chicken salad?,calories
How many calories are in a large fry?,calories
A large french fry has how many calories?,calories
What is the calorie content of a scoop of chocolate ice cream?,calories
How many calories in scoop of chocolate ice cream?,calories
Tell me how many calories in a medium size apple?,calories
How many calories does a scoop of chocolate ice cream have?,calories
How many calories are in a can of coke?,calories
What's the number of calories in a pepsi?,calories
What is the calorie content of a small bag of lay's potato chips?,calories
How many calories does a kitkat have?,calories
How many calories are there in a scoop of chocolate ice cream?,calories
How many calories does a scoop of chocolate ice cream contain?,calories
What's the expected calories in a cream filled cookie?,calories
What's the amount of calories in a cheesy omelette?,calories
Can you tell me the calorie count in a glazed donut?,calories
What's the calorie count for tuna casserole?,calories
How many calories are in waffles?,calories
What's the calorie content for fried eggs?,calories
What's the amount of calories in an cream filled oatmeal cookie?,calories
How many calories are in chocolate cake?,calories
How high in calories is pork?,calories
How many calories are in a honey bun?,calories
What does a sausage sandwich have for calories?,calories
What's the number of calories in a coke?,calories
What are the total calories for two servings of pasta?,calories
How many calories should i plan to be in a donut?,calories
How many calories would i estimate for fettuccine alfredo?,calories
How many calories does a big mac have?,calories
What's the caloric content if you eat roast beef?,calories
How many calories would i consume if i ate a loaded hotdog?,calories
What's the expected calorie load of a peanut butter and jelly sandwich?,calories
What's a big bowl of ice cream contain in calories?,calories
Do cheetos have a lot of calories?,calories
What's the calorie content of cheetos?,calories
Looks up the calories in cheetos?,calories
Calorie count of cheetos?,calories
How many calories do cheetos have?,calories
How many calories are in a cup of white rice?,calories
How many calories are in vanilla ice cream?,calories
One cup of almonds has how many calories?,calories
What's the calorie info for 2 cups of regular chex mix?,calories
What's the caloric content in a bowl of rice crispies with milk?,calories
A bowl of cheerios with milk has how many calories?,calories
How many calories are in a bag of regular doritos?,calories
How many calories are in chocolate ice cream?,calories
2 cups of grapes have how many calories?,calories
How many calories are in spaghetti and meat sauce?,calories
"In one cookie, how many calories would i find?",calories
What is the calorie count for one cookie?,calories
"If i ate a cookie, how many calories would i be ingesting?",calories
Cookies have how many calories?,calories
How many calories are in a cookie?,calories
How many calories in gum?,calories
How many calories in chicken?,calories
How many calories in meatloaf?,calories
How many calories are in chicken breast?,calories
How many calories in peanuts?,calories
What is the total number of calories in a bag of potato chips?,calories
Can you tell me the amount of calories i can expect one tuna sandwich to contain?,calories
Give me expected number of calories in a breakfast burrito?,calories
Can you tell me the number of calories in one serving of whole cashews?,calories
Please tell me the total calories a single serving of chocolate ice cream is expected to contain?,calories
I need to know the total calories for a chicken caesar salad?,calories
Please tell me how many calories one chocolate bar contains?,calories
What's the average number of calories in one cup of tomato soup?,calories
Do you know how many calories are in a single chicken breast?,calories
I need to know the number of calories on average in a handful of pistachios?,calories
What is the caloric value of a cookie?,calories
How many calories are in cookies?,calories
Can you tell me how many calories are in cookies?,calories
What is the calorie count in a cookie?,calories
What are the calories in a cookie?,calories
What is the calorie count for muffins?,calories
Are there a lot of calories in muffins?,calories
Tell me the amount of calories in muffins?,calories
What is the caloric total in these muffins?,calories
What amount of calories are in one muffin?,calories
Look up the calories in an apple?,calories
Tell me the calorie content of an apple?,calories
What's the caloric content of an apple?,calories
Tell me the calorie content for an apple?,calories
I need to know the calorie content in a piece of pepperoni pizza?,calories
How many calories are in an apple?,calories
I want the calorie content for a banana?,calories
Tell me the number of calories in a banana?,calories
What is the calorie look like in apples?,calories
What is the calorie going to be if i'm eating cereal?,calories
Add up the calories in tacos?,calories
How many calories are in cheerios?,calories
What type of calorie numbers are in onions?,calories
I need to know the calorie count of a bacon cheeseburger?,calories
Whats the calorie content of oatmeal?,calories
What is the calorie count of an apple?,calories
How many calories on average are in a hot dog?,calories
How many calories are in a piece of bacon?,calories
Let my credit card company know that my card split in half?,damaged_card
How do you report a burned debit card?,damaged_card
"My card split in half, how do i report it?",damaged_card
Report my burned card to the company?,damaged_card
What do i say when i report a split credit card?,damaged_card
My card was damaged by my cat; can i report that?,damaged_card
I dropped my card in my gasoline and the printing wore off?,damaged_card
I need to report that my dog chewed up my card?,damaged_card
It seems i can't use my card since it has been damaged?,damaged_card
"Unfortunately, my card is damaged and unusable?",damaged_card
What should i do with an unusable and damaged card?,damaged_card
My card is unusable because it's damaged?,damaged_card
I cracked my card and need a replacement?,damaged_card
My card got melted and i need to report it?,damaged_card
"My card got melted and i need to report it, please?",damaged_card
"My card got melted in the dryer and i need to report it, please?",damaged_card
My card got damaged and i need to report it?,damaged_card
"My card got damaged and i need to report it, please?",damaged_card
My card is damaged so i can not use it?,damaged_card
Report the card has been damaged?,damaged_card
"I can not use my card, it is damaged?",damaged_card
"The card is torn, let's report it?",damaged_card
Report that the card has been wrecked?,damaged_card
My card is damaged and no longer function?,damaged_card
My card is damaged and unusable?,damaged_card
"My card is wrecked, let's report it?",damaged_card
Report the card has been torn?,damaged_card
I can not use my card since it is damaged?,damaged_card
I need to report a bent card?,damaged_card
"My card split in half, can i report it?",damaged_card
"I cracked my card, order a new one?",damaged_card
Report that i split my card?,damaged_card
Please make a report that my card is split?,damaged_card
"The magnetic strip on my card is scratched, let the card company know?",damaged_card
"I cut up the wrong card, please contact the bank and let them know?",damaged_card
"I creased my card today, contact the bank?",damaged_card
"My card is cracked, please tell the card company?",damaged_card
"The dog chewed up my card, will you find out what it takes to get a replacement?",damaged_card
The plastic numbers on my card are falling off?,damaged_card
Corner of my credit card is chipped off?,damaged_card
My card got snapped in half?,damaged_card
My card is too scratched and won't read correctly?,damaged_card
The sticker on my card is peeling off?,damaged_card
I can't use my card because it is broken?,damaged_card
My broken card won't work?,damaged_card
I can't use my damaged card?,damaged_card
My damage card is not working?,damaged_card
My damage card will not work?,damaged_card
I don't know who to notify that i ran my credit card over with the lawn mower?,damaged_card
I ran my credit card over with the lawn mower and need to replace it?,damaged_card
I need to replace my credit card because i ran it over with the lawn mower?,damaged_card
My card is partially damaged how do i report this?,damaged_card
My card is not working and i need to let them know?,damaged_card
My card broke in half and i need to report this?,damaged_card
The chip on my card is damaged and i need a new one?,damaged_card
My card's magnetic strip is not working and i want to notify them?,damaged_card
My card has a deep crease through the middle so i would like to report it?,damaged_card
How do i report my card if it got cut in half?,damaged_card
My card is cracked and i want to report it?,damaged_card
My card is too scratched up and i need to report it?,damaged_card
I need to report my bent card?,damaged_card
Report to the company that i damaged my card?,damaged_card
Call the card company and ask them to replace my card?,damaged_card
I damaged the card; can you replace the card?,damaged_card
I demagnetized my card and want to report it?,damaged_card
I want to report a broken card?,damaged_card
"My phone was too close to my card and demagnetized it, how can i report this?",damaged_card
My card has been erased and i need to report it?,damaged_card
"I need a report form for my damaged, demagnetized card?",damaged_card
How to report bent credit card?,damaged_card
I can't use my broken card?,damaged_card
I broke my card?,damaged_card
How to tell the company that my credit card melted?,damaged_card
My card is broken?,damaged_card
My card isn't working?,damaged_card
Who do i report to if my credit card snaps?,damaged_card
"I accidentally bent my card, what do i do?",damaged_card
My card doesn't work anymore?,damaged_card
How do i report a melted credit card?,damaged_card
"My card needs replaced, i accidentally scraped it?",damaged_card
"I'd like to report my card as damaged, it's bent?",damaged_card
"I bent my card, can you report it to my bank?",damaged_card
"My card got scratched badly, can you tell my bank to send a replacement?",damaged_card
"My card snapped, can you tell my bank to send a replacement?",damaged_card
I accidentally put my credit card in the shredder?,damaged_card
My credit card fell out of my back pocket and got flushed down the toilet?,damaged_card
My credit card snapped in half while i was fiddling with it?,damaged_card
My dog ate my credit card and ruined it?,damaged_card
I was using my credit card as a cutting board and accidentally sliced it in half?,damaged_card
Can you assist me with reporting that the atm nicked my card?,damaged_card
I need to report a new card please the atm hurt mine?,damaged_card
How report that scratched my card?,damaged_card
The atm chewed up my card can i get a new one?,damaged_card
"An atm ate my card, how do i report it?",damaged_card
My card fell out of my wallet and i ran over it so it does not work?,damaged_card
My card fell in the toilet and now the chip does not work?,damaged_card
The magnetic strip on my card is scratched up pretty badly from overuse can i get a new one?,damaged_card
I need a new card because my dog chewed on it and now it does not work?,damaged_card
I want to report my damaged card i accidentally cut it up thinking it was my expired card?,damaged_card
I cracked my rewards card can i get a different one?,damaged_card
Do people like the donuts at tgi?,restaurant_reviews
Are the donuts at tgi well reviewed?,restaurant_reviews
How are the donuts reviews at tgi?,restaurant_reviews
What are the comments on the donuts at tgi?,restaurant_reviews
Are people recommending the donuts at tgi?,restaurant_reviews
Does outback steakhouse have good reviews?,restaurant_reviews
Does pizza hut have good reviews?,restaurant_reviews
Does have good reviews have great reviews?,restaurant_reviews
Does red robin have good reviews?,restaurant_reviews
So does outback steakhouse have good reviews?,restaurant_reviews
How good are the ratings for pizza hut?,restaurant_reviews
How good are the ratings for red robin?,restaurant_reviews
How good are the ratings for outback?,restaurant_reviews
How good are the ratings for papa john's?,restaurant_reviews
How good are the ratings for the olive garden?,restaurant_reviews
What are people saying about chipotle?,restaurant_reviews
Tell me the reviews for chipotle?,restaurant_reviews
Do people like chipotle?,restaurant_reviews
Give me the reviews for chipotle?,restaurant_reviews
What are the ratings for chipotle?,restaurant_reviews
How good are the ratings for chic-fil-a?,restaurant_reviews
How good are the ratings for olive garden?,restaurant_reviews
How good are the ratings for longhorn steakhouse?,restaurant_reviews
Does chic-fil-a have good reviews?,restaurant_reviews
How good are the ratings for outback steakhouse?,restaurant_reviews
How good are the ratings for applebees?,restaurant_reviews
Does wendy's have good reviews?,restaurant_reviews
Does mcdonalds have good reviews?,restaurant_reviews
Does longhorn steakhouse have good reviews?,restaurant_reviews
What reviews does miyabi have?,restaurant_reviews
Does applebee's have good reviews?,restaurant_reviews
How are the reviews for cracker barrel?,restaurant_reviews
Are the reviews for mi casita good?,restaurant_reviews
Are the reviews good or bad for burger king?,restaurant_reviews
Tell me the ratings for the local denny's?,restaurant_reviews
Does the bleu olive have decent reviews?,restaurant_reviews
How are the reviews for la loconda?,restaurant_reviews
How many stars does la vignette have?,restaurant_reviews
Does the mediterranean grille have good reviews?,restaurant_reviews
Have you heard how the enchiladas are at jose's taco shop?,restaurant_reviews
How does yelp report the enchiladas are at jose's taco shop?,restaurant_reviews
Does ihop have good reviews?,restaurant_reviews
Can you tell me if eating at outback's any good?,restaurant_reviews
What do people say about village inn?,restaurant_reviews
Are the pancakes at ihop any good?,restaurant_reviews
How are the reviews for spaghetti at the olive garden?,restaurant_reviews
How's the lo mein rated at hun lee's?,restaurant_reviews
How's the sausage pizza at pizza hut?,restaurant_reviews
Is mcdonalds a good place to eat?,restaurant_reviews
What's the reviews have to say about burger king?,restaurant_reviews
How are the burgers at carl jr's?,restaurant_reviews
Are the chili's reviews any good?,restaurant_reviews
Are the reviews for applebee's good?,restaurant_reviews
I want to know how the mcdonalds reviews are?,restaurant_reviews
Tell me about the reviews for chilis?,restaurant_reviews
Let me know how the outback steakhouse reviews are?,restaurant_reviews
How good are the ratings for per se?,restaurant_reviews
What are the reviews like for khin khao?,restaurant_reviews
