text,intent
Where are my rewards for my chase card?,rewards_balance
What's the point balance on my marriot rewards card?,rewards_balance
How many points do i have in total on my marriot rewards card?,rewards_balance
Show me the total up to date points on the marriot rewards card?,rewards_balance
My marriot rewards card has how much for a point total?,rewards_balance
Give my my current points on my marriot rewards card?,rewards_balance
Can you tell me my starbucks rewards balance?,rewards_balance
Can you help me tell what my starbucks rewards balance is?,rewards_balance
What is the remainder of my starbucks rewards balance?,rewards_balance
My starbucks rewards balance is?,rewards_balance
What is the total amount of my starbucks rewards balance?,rewards_balance
I have how many points on my amex right now?,rewards_balance
How many points are on my speedway card right now?,rewards_balance
I have how many tier credits on my caesar's card?,rewards_balance
How many points do i have on my mlife card?,rewards_balance
How many delta miles are on my card right now?,rewards_balance
How many rewards do i have on my chase card?,rewards_balance
How do i find out my rewards balance on my chase card?,rewards_balance
Can i check my visa reward balance online?,rewards_balance
When can i receive rewards on my visa card?,rewards_balance
How do i check how many rewards i have on my master card?,rewards_balance
How do i check my rewards for my gold card?,rewards_balance
What rewards does my gold card get?,rewards_balance
Where do i find my gold card rewards?,rewards_balance
What is the number of remaining rewards points on my chase card?,rewards_balance
I need to find out the rewards points i have left on my american express card?,rewards_balance
What is the amount of rewards points on my visa card?,rewards_balance
Do you know how many rewards points are currently on my discover card?,rewards_balance
Does my mastercard have any rewards points remaining?,rewards_balance
Put my points up for master card?,rewards_balance
Figure out my reward points for discovery card?,rewards_balance
Add all of my points for my current discover card?,rewards_balance
Calculate my points for visa?,rewards_balance
Add up my reward points for master card?,rewards_balance
What the current balance of reward points on my mastercard?,rewards_balance
What's my reward balance on my amex card?,rewards_balance
How do i get my rewards balance on my diner's club card?,rewards_balance
How many reward points does my discover card have?,rewards_balance
Tell me how to check rewards on my american express card?,rewards_balance
"I want to pay my bill, please?",pay_bill
Pay my water bill with my charles schwab account?,pay_bill
I'd like to pay my bill?,pay_bill
Pay my internet bill with my discover account?,pay_bill
Can you help me pay a bill?,pay_bill
I need to pay my bill?,pay_bill
Can i pay a bill?,pay_bill
Use my capital one account to pay for my gas bill?,pay_bill
Pay my electric bill from my amex account?,pay_bill
I want to pay my house bill?,pay_bill
I want to pay my car bill?,pay_bill
I want to pay my insurance bill?,pay_bill
I want to pay my tax bill?,pay_bill
I need help paying my auto insurance bill?,pay_bill
I need help paying my hoa bill?,pay_bill
I need help paying my tuition bill?,pay_bill
I need help paying my phone bill?,pay_bill
"My water bill is due, pay it immediately?",pay_bill
I need to pay my water bill?,pay_bill
Please go ahead and make my student loan payment?,pay_bill
Go ahead and pay my american express bill now?,pay_bill
I need to pay my electric bill now?,pay_bill
Can you assist me in paying my electric bill?,pay_bill
I want to do a payment on my water bill?,pay_bill
Pay my mortgage from my checkings accounts?,pay_bill
Do a car payment from my savings account?,pay_bill
Can you give me a hand paying my water bill?,pay_bill
I want to pay off my student loan?,pay_bill
I need a bit of hand holding getting my trash bill paid?,pay_bill
I need to pay my mortgage?,pay_bill
Are you able to help me pay my mortgage?,pay_bill
I want to pay my car payment?,pay_bill
I need to pay this month's tv subscription fee?,pay_bill
Will you aid me in paying my insurance premium?,pay_bill
Pay a bribe using my money market account?,pay_bill
Use my savings account to the pay the rent?,pay_bill
Use my checkings account to pay the electric bill?,pay_bill
I'd like to pay my coned bill?,pay_bill
Please help with paying my cell phone bill?,pay_bill
I'd like to make a payment on my credit card bill?,pay_bill
I would like to pay my cell phone bill?,pay_bill
Please help me pay my cable bill?,pay_bill
Please tell me how to pay my gas bill?,pay_bill
I need to get help paying my gas bill?,pay_bill
I need help to pay my electric bill?,pay_bill
Can you help me pay my phone bill?,pay_bill
Will you take my bill payment?,pay_bill
Is it possible to pay my bill?,pay_bill
How can i pay my bill?,pay_bill
Can i pay my bill?,pay_bill
Use my park bank account to pay my electric bill?,pay_bill
Pay my electric bill from my park bank account?,pay_bill
Pay my gas bill from my saving account?,pay_bill
Pay my cable bill from my facebook account?,pay_bill
Pay my cell bill from my deposit account?,pay_bill
Pay my electric bill from my paypal account?,pay_bill
Pay my water bill from my checking account?,pay_bill
Pay my phoe bill with my debit card?,pay_bill
Schedule a gas bill payment?,pay_bill
Pay the cable bill with my visa card?,pay_bill
Pay the red cross the monthly donation?,pay_bill
I want to pay my internet bill?,pay_bill
I want to pay my gas bill?,pay_bill
I want to pay my electric bill?,pay_bill
I want to pay my rent bill?,pay_bill
I want to pay my water bill?,pay_bill
Make a payment on the electric bill?,pay_bill
Help me pay my electric bill?,pay_bill
Pay the electric bill?,pay_bill
Pay electric?,pay_bill
Please pay electric bill?,pay_bill
I got to pay my cable bill?,pay_bill
I need help paying my store bill?,pay_bill
I wanna pay my cable bill from my checking account?,pay_bill
I need help paying my cable bill?,pay_bill
Pay my cable bill from my checking account?,pay_bill
I must pay my cable bill from my checking account?,pay_bill
I gotta pay my cable bill?,pay_bill
I must pay my cable bill?,pay_bill
I wish to pay my cable bill?,pay_bill
I need to pay my cable bill?,pay_bill
I need help paying my rent bill?,pay_bill
I need help paying my water bill?,pay_bill
I really want to pay my cable bill from my checking account?,pay_bill
I need help paying my electric bill?,pay_bill
I need to pay my cable bill from my checking account?,pay_bill
What's the best way to pay my bill?,pay_bill
I'd really like to pay this bill?,pay_bill
Can you help me pay this bill?,pay_bill
I am not sure how to pay my phone bill and need assistance?,pay_bill
I need to make a bill payment?,pay_bill
Please pay my bill?,pay_bill
Can anyone help me pay my car bill?,pay_bill
I want to pay that bill now?,pay_bill
Is there anyone available to help pay an internet bill?,pay_bill
I need anyone who can help me pay my electric bill?,pay_bill
Help me pay my cable bill?,pay_bill
Can you pay the bill now?,pay_bill
I need your help to pay my gas bill?,pay_bill
Pay my insurance bill?,pay_bill
How much did i spend at restaurants last week?,spending_history
How much have i spent lately on eating out?,spending_history
What did i spend at the grocery store yesterday?,spending_history
How much money did i spend at starbucks in the last week?,spending_history
What was the total i spent at home depot last month?,spending_history
Where did all my money go this month?,spending_history
What have my expenditures been at macys?,spending_history
How much did i spend this week?,spending_history
How much did i spend on christmas gifts in december?,spending_history
How much money did i spend yesterday?,spending_history
What did i spend at bath and body works last month?,spending_history
How much did i spend on lunches last week?,spending_history
What amount did i spend last week?,spending_history
What did i spend my money on last week?,spending_history
How much did i spend on movies last week?,spending_history
Have i been spending a lot on groceries lately?,spending_history
Have i been spending a lot on shoes lately?,spending_history
Have i been spending a lot on food lately?,spending_history
Have i been spending a lot on alcohol lately?,spending_history
Have i been spending a lot on take out lately?,spending_history
How much have i spent on shoes lately?,spending_history
Did i spend a lot on shoes recently?,spending_history
How much have i spent on shoes?,spending_history
Have i have been spending a lot of money on shoes?,spending_history
What is the total i spent on shoes recently?,spending_history
What have i spent over the last few days?,spending_history
How much have i spent recently?,spending_history
How much money have i dropped recently?,spending_history
How much money have i spent this month?,spending_history
What's the amount of money i spent yesterday?,spending_history
Could you tell me how much i've spent over the past two weeks?,spending_history
How much money have i spent this week?,spending_history
Could you tell me how much money i spent last week?,spending_history
Please tell me how much i have spent recently?,spending_history
How much did i spend last week?,spending_history
Can you tell me my spending history from last week?,spending_history
I want to know how much i spent last week?,spending_history
I want to know my recent spending?,spending_history
How much have i paid for rent in the last 6 months?,spending_history
How much money have i spent on groceries recently?,spending_history
How much did i spend on groceries today?,spending_history
How much have i spent eating out this week?,spending_history
What chunk of my income have i spent on rent this year?,spending_history
What's it been costing me to buy three packs a day?,spending_history
What have car repairs ran me this month?,spending_history
What has gas cost me this week?,spending_history
What did car insurance run me this year?,spending_history
What's the total amount i've spent eating out in the last two weeks?,spending_history
How much have i spent on alcohol recently?,spending_history
How much have i spent on books recently?,spending_history
How much have i spent on food recently?,spending_history
How much have i spent on bills recently?,spending_history
How much have i spent on clothes recently?,spending_history
I need to know my total spending on amazon for november and december 2018?,spending_history
Please list my total spending on grocery shopping for the last two months?,spending_history
How much have i spent on starbucks since the beginning of 2019?,spending_history
What is my total spent on dining out for the month of january?,spending_history
What is the total amount that i have spent on the cash app for this month so far?,spending_history
Have i spent a lot on food recently?,spending_history
I need to know what i have spent on food recently?,spending_history
Can you tell me what i have spent on food recently?,spending_history
What have i spent on food recently?,spending_history
What is the amount i have spent on food recently?,spending_history
How much have i lately spent on eating out?,spending_history
What have i spent lately in child care?,spending_history
How much have i spent lately on food?,spending_history
How much money have i recently spent on entertainment?,spending_history
How much have i paid in medical expenses recently?,spending_history
How much did i spend on gas last week?,spending_history
Can you tell me what i spend on gas for the past two weeks?,spending_history
Yesterday what did i spend on lunch?,spending_history
I need to know what i spend on utilities for the last year?,spending_history
What did i spend on groceries this month?,spending_history
Have i been giving lot of money to food to food lately?,spending_history
How much money did i use to spend on catering five hours ago?,spending_history
How much did i spend on gear two weeks ago?,spending_history
Have i been spending a lot on roast beef lately?,spending_history
Have i been spending a ton of money on movies lately?,spending_history
How much money did i spend on tent equipment four hours ago?,spending_history
How much did i spend on furniture last week?,spending_history
How much did i spend on petrol 2 days ago?,spending_history
How much money did i spend on food last month?,spending_history
Would please let me know how much i spent on food in january?,spending_history
Could you check my account and let me know how much i spent on food in january?,spending_history
Please check and tell me the amount i spent on food last month?,spending_history
Let me know the amount i spent on food last month?,spending_history
I have been spending a lot on food out lately?,spending_history
I have spent a lot on groceries lately?,spending_history
I spent a lot on vacations recently?,spending_history
I have been spending a lot on utility bills lately?,spending_history
I have been spending a lot on insurance lately?,spending_history
Did i go out to eat more than usual?,spending_history
Have i been spending more money at restaurants?,spending_history
How much did i spend on food?,spending_history
How much do i spend going out to eat?,spending_history
What's my going out to eat tab this month vs last month?,spending_history
How much did i spend shopping for clothes today?,spending_history
How much did i spend the past 3 days?,spending_history
How much did i spend on gas the past month?,spending_history
How much have i spent on food in the past week?,spending_history
Have they approved my vacation request yet?,pto_request_status
Give me the status of my vacation request?,pto_request_status
Am i going to be able to get my vacation request?,pto_request_status
I want to check on my vacation request?,pto_request_status
Is my vacation approved yet?,pto_request_status
"My vacation, has it been approved yet?",pto_request_status
Have i been approved for vacation yet?,pto_request_status
Am i approved for vacation yet?,pto_request_status
Did they approve my day off request?,pto_request_status
Is my day off approved?,pto_request_status
Did they say yes to my day off request?,pto_request_status
Did i get my day off?,pto_request_status
Is my day off request approved?,pto_request_status
Update on vacation request?,pto_request_status
What is the current status of my vacation request?,pto_request_status
I need status on that vacation request?,pto_request_status
How is my vacation request looking?,pto_request_status
Please inform me on my current vacation request status?,pto_request_status
Have they recieved my vacation request and approved it?,pto_request_status
Will my vacation be approved soon?,pto_request_status
Did my vacation get approved?,pto_request_status
Do we have good news in the form of vacation approval?,pto_request_status
Has my vacation request been acknowledged?,pto_request_status
Has my request for vacation days been signed by my supervisor yet?,pto_request_status
Has my supervisor approved my vacation?,pto_request_status
Has may supervisor approved the vacation days i asked for?,pto_request_status
"On my vacation request, what is the latest information?",pto_request_status
What is the news on my vacation request?,pto_request_status
What is the update on my vacation request?,pto_request_status
What is the most recent info for my request for vacation?,pto_request_status
What is the status for what i requested for my vacation?,pto_request_status
Tell me about my vacation request?,pto_request_status
Update me on my vacation request?,pto_request_status
What about my vacation request?,pto_request_status
Has the status of my vacation request changed?,pto_request_status
Has my vacation request been updated?,pto_request_status
Has my vacation time been signed off on?,pto_request_status
What's my vacation status?,pto_request_status
Has my vacation been approved?,pto_request_status
Has my vacation been ok'd?,pto_request_status
Will i be allowed to take vacation?,pto_request_status
Are they going to let me take vacation?,pto_request_status
Has my request for vacation time been okayed?,pto_request_status
Has my vacation time at work been allowed?,pto_request_status
Is walmart going to let me take the vacation time i asked for?,pto_request_status
I'm i okayed for vacation time?,pto_request_status
Did you get confirmation my vacation is a go?,pto_request_status
Is the request for vacation i filed with my manager at intel approved yet?,pto_request_status
Do you know if my vacation request went through?,pto_request_status
Has my manager at mcdonald's confirmed i can take vacation?,pto_request_status
Have they authorized my vacation?,pto_request_status
I want to know if my vacation request has been approved?,pto_request_status
"The status of my day off request, please?",pto_request_status
Do you know if my vacation request has been approved?,pto_request_status
Has my vacation request been approved?,pto_request_status
What is the status of my vacation request?,pto_request_status
Any news for me regarding my day off request?,pto_request_status
I want to know the status of my day off request?,pto_request_status
Tell me the status of my vacation request?,pto_request_status
Tell me the status of my day off request?,pto_request_status
Could you tell me the status of my vacation request?,pto_request_status
I requested some vacation time; has it been approved?,pto_request_status
Can you share the status of my day off request?,pto_request_status
Was my day off request approved?,pto_request_status
Status of my request for vacation?,pto_request_status
What's my day off request's status?,pto_request_status
Has my day off request been approved or denied yet?,pto_request_status
Has my vacation request been denied or approved yet?,pto_request_status
Has my request for the day off been approved yet?,pto_request_status
How is the approval of my day off progressing?,pto_request_status
How is the approval of my day off going?,pto_request_status
Whats going on with my day off request?,pto_request_status
Any status update on my day off request?,pto_request_status
Did you hear back about my day off request?,pto_request_status
Is my day off request still pending?,pto_request_status
Has anyone looked over my request for a day off?,pto_request_status
Has anyone approved my day off request?,pto_request_status
How's my day off request looking?,pto_request_status
Has my day off request been looked at yet?,pto_request_status
I need you to let me know what the status of my day off request is?,pto_request_status
Please let me know what the status of my day off request is?,pto_request_status
Could you tell me what the status of my day off request is?,pto_request_status
Would you tell me what the status of my day of request is?,pto_request_status
I need to know the status of my day off request?,pto_request_status
Has my vacation request been approved yet?,pto_request_status
Has my vacation been approved yet?,pto_request_status
Has my time off request been approved yet?,pto_request_status
Check on the status of my vacation request please?,pto_request_status
Please check to see if my vacation request has been updated?,pto_request_status
Please find out the status of my vacation request?,pto_request_status
Do you know if my vacation was approved yet or not?,pto_request_status
Please tell me if my vacation has been approved or not?,pto_request_status
Can you look into the status of my vacation request?,pto_request_status
I want to know what the latest is on my vacation request i submitted?,pto_request_status
I need to know if my vacation was approved?,pto_request_status
Please check to see if my vacation has been approved?,pto_request_status
Do you know if my vacation request is still pending?,pto_request_status
Can you find out if my vacation time off request has been approved or not?,pto_request_status
I sent in a request for vacation time off and am wondering if its been approved yet?,pto_request_status
"I haven't heard if my request for time off for vacation has been approved , can you get an update for me?",pto_request_status
How do i look up my credit score?,credit_score
Please look up my credit score?,credit_score
Can you figure out how to find my credit score?,credit_score
Are you able to lookup my credit rating?,credit_score
How can i find my credit rating?,credit_score
Where can i check my credit rating?,credit_score
Say my credit score?,credit_score
Give me my credit score?,credit_score
I want my credit score?,credit_score
Inform me of my credit score?,credit_score
Clue me in on my credit score?,credit_score
Provide me with my credit score?,credit_score
My credit score is?,credit_score
I need my credit score?,credit_score
Find my credit score for me?,credit_score
What is my credit score?,credit_score
Please get my credit score?,credit_score
Can you find my credit score?,credit_score
I'd like to know what my credit rating is?,credit_score
Please tell me my credit rating?,credit_score
What in the world is my credit rating?,credit_score
My credit score is what?,credit_score
Tell me my credit score please?,credit_score
Can you tell me my credit score?,credit_score
Find my credit score and tell it to me?,credit_score
Get my credit score?,credit_score
What is my exact credit score?,credit_score
How good is my credit score?,credit_score
What's my credit score rating?,credit_score
What kind of credit score do i have?,credit_score
"If i want my credit score, how do i find it?",credit_score
How do i find information about my credit score?,credit_score
What is the process of finding my credit score?,credit_score
How do i get my credit score?,credit_score
How do i locate my current credit score?,credit_score
Where is my credit score?,credit_score
How do i see my credit score?,credit_score
How exactly do i find my credit score?,credit_score
How do i locate my credit score?,credit_score
How do i find out what my credit score is?,credit_score
I really wanna know my credit score?,credit_score
I wish to know my credit rating?,credit_score
Let me understand my credit rating?,credit_score
I wanna know my credit rating now?,credit_score
I gotta know my credit score?,credit_score
Tell me my credit rating?,credit_score
I would love to know my credit score?,credit_score
I wish to know my credit score?,credit_score
I wanna know my credit score?,credit_score
Tell me what my credit rating is?,credit_score
Can you provide me my credit score?,credit_score
I'd like the number for my credit score?,credit_score
Tell me my credit score?,credit_score
Verify with me my credit score?,credit_score
Can you help me find my credit score?,credit_score
Would you tell me my credit score?,credit_score
How do i find my credit score?,credit_score
Will you tell me my credit score?,credit_score
Do you know my credit score?,credit_score
How to see my credit score?,credit_score
Can i see my credit score?,credit_score
Hows my credit score?,credit_score
Websites that share credit ratings?,credit_score
What's my credit rating?,credit_score
How do i find out my credit rating?,credit_score
How to locate my credit score?,credit_score
Where is my credit score located?,credit_score
Where can i find my credit score?,credit_score
Find my credit score?,credit_score
Tell me the steps to getting my credit score?,credit_score
Help me locate my credit score?,credit_score
Lets look up my credit score?,credit_score
I would like to look up my credit score please?,credit_score
I want to find out what my credit score is?,credit_score
Help me find my credit score?,credit_score
What is my fica score?,credit_score
Can you reveal my credit score?,credit_score
How is my credit score rated?,credit_score
Any idea what my credit score is?,credit_score
Show me my credit score please?,credit_score
Let me know what my credit score is?,credit_score
Is my credit score high?,credit_score
I am trying to find my credit score?,credit_score
Show me my credit score?,credit_score
How does my credit score look?,credit_score
Is my credit report low?,credit_score
Whats my credit rating?,credit_score
What is my current credit score?,credit_score
Where can i check my credit score?,credit_score
Where can i see my credit score?,credit_score
How can i find out my credit score?,credit_score
Inform me of my current credit rating?,credit_score
Please notify me of my credit rating?,credit_score
I would like to be told about my credit rating?,credit_score
Can you tell me about my credit rating?,credit_score
Tell me my current credit rating?,credit_score
What is the number of my credit score?,credit_score
What's my credit score?,credit_score
Let me know my credit score?,credit_score
How is my credit score?,credit_score
How can i apply for a discover card?,new_card
Can i apply for a discover card?,new_card
How do applications for discover cards work?,new_card
Is this how i apply for a discover card?,new_card
What does it take to get a new card?,new_card
How do i sign up for a new credit card?,new_card
Can i complete an application for a new credit card?,new_card
Is it possible to get a new credit card?,new_card
Please show me how to apply for a visa card?,new_card
I need to apply for a visa card?,new_card
I need to know how to apply for a visa card?,new_card
Tell me how to apply for a visa card?,new_card
What is the process to apply for a visa card?,new_card
Show me how to apply for a visa card?,new_card
Can you let me know the info on how to apply for a visa card?,new_card
