text,intent
What expression would i use to say i love you if i were an italian?,translate
"Can you tell me how to say 'i do not speak much spanish', in spanish?",translate
"What is the equivalent of, 'life is good' in french?",translate
"Tell me how to say, 'it is a beautiful morning' in italian?",translate
"If i were mongolian, how would i say that i am a tourist?",translate
How do i say 'hotel' in finnish?,translate
"I need you to translate the sentence, 'we will be there soon' into portuguese?",translate
Please tell me how to ask for a taxi in french?,translate
"Can you tell me how i would say, 'more bread please' in french?",translate
What is the correct way to say 'i am a visitor' in french?,translate
"How would i say, 'i don't know the answer' in spanish?",translate
I would like to know the proper way to greet an adult in portuguese?,translate
What words would i use to tell someone i am lost if i were japanese?,translate
How would i say thank you if i were russian?,translate
Can you tell me how i would normally say thank you as a french person?,translate
I would like to know how to say hello in french?,translate
If i were english how would i say subway?,translate
I would i say subway if i were english?,translate
How do you say hi in french?,translate
In england how do they say subway?,translate
Translate hello in french?,translate
How is hello said in french?,translate
What do you call a subway if you were english?,translate
How would i say if i were english subway?,translate
How should i say hello in french?,translate
How could i say twin in chinese?,translate
How can i say not now in spanish?,translate
What do spanish people say for the word cow?,translate
Translate hello to english?,translate
How do you say goodbye in spanish?,translate
How would i say love in french?,translate
Could you translate atm machine into english?,translate
Please translate grocery into french for me?,translate
How do germans say goodnight?,translate
Tell me how the russians say notebook?,translate
How do vietnameses people say hello?,translate
How do i say thank you in japanese?,translate
What is latin for i love you?,translate
How can i thank somebody in italian?,translate
How do i say you're welcome in chinese?,translate
Translate hello english to french?,translate
What is hello in french?,translate
What phrase means goodbye in hawaii?,translate
What spanish word means hello?,translate
Translate hello to french?,translate
Translate english to french hello?,translate
What is the word for hello spanish?,translate
How do they say goodbye in hawaii?,translate
What's local slang for goodbye in hawaii?,translate
How do you say hello in french?,translate
Tell me how to say hello in spanish?,translate
What do i say for goodbye in hawaii?,translate
Translate hello into french for me?,translate
How do i say hello in french?,translate
Translate for me hello into french?,translate
How would they say say goodbye in hawaii?,translate
What is spanish for hello?,translate
How would i say hello in french?,translate
How can i say i love you in italy?,translate
What is spanish for good morning?,translate
How do you say it's snowing in german?,translate
How would you say can i borrow five dollars in portuguese?,translate
Do you know how to say where is the restroom in french?,translate
How would i say pleased to meet you if i were japanese?,translate
Can you translate hello into swedish for me?,translate
Can you translate i love you into french for me?,translate
Can you translate where's the bar into irish for me?,translate
How would i say goodbye if i were norwegian?,translate
How would i say i love you if i were french?,translate
How would i say hello if i were swedish?,translate
Can you translate good bye into russian for me?,translate
Can you translate i have to go pee into korean for me?,translate
How would i say i'm not guilty if i were mexican?,translate
How do you say thank you in spanish?,translate
How does one say thank you in spanish?,translate
How can i say thank you in spanish?,translate
What is thank you in spanish?,translate
What is the way to say thank you in spanish?,translate
"How do they say ""who is your father"" in german?",translate
"How do they say ""where's the bathroom"" in spanish?",translate
"How do they say ""how's it going"" in swahili?",translate
"How do they say ""i love you"" in japanese?",translate
"How do they say ""what's up"" in chinese?",translate
How do you say thank you in german?,translate
How do you say please in arabic?,translate
How do you say cat in spanish?,translate
How do you say i'm hungry in french?,translate
How do you say i need coffee in dutch?,translate
How do they say yes in brazil?,translate
Can you translate cat into russian for me?,translate
Can you translate bowl into russian for me?,translate
How do they say hello in france?,translate
I wanna know a phrase in spanish?,translate
Can you translate bat into russian for me?,translate
How do they say no in germany?,translate
Can you translate hi into spanish for me?,translate
I wanna learn a phrase in russian?,translate
How do they say hello in germany?,translate
Can you translate milk into spanish for me?,translate
How do they say hello in brazil?,translate
I need $20000 transferred from my savings to my checking?,transfer
Complete a transaction from savings to checking of $20000?,transfer
Transfer $20000 from my savings account to checking account?,transfer
Take $20000 from savings and put it in checking?,transfer
Put $20000 into my checking account from my savings account?,transfer
Send 100 dollars between bank of the west and bank of america acccounts?,transfer
Send 50 dollars between bank of america and chase accounts?,transfer
Send 2000 dollars between chase and rabobank accounts?,transfer
Send 1200 dollars between usaa and navy federal accounts?,transfer
Send 400 dollars between city bank and usaa accounts?,transfer
Take $40 and transfer it to account a from b?,transfer
Transfer $40 from account a to b?,transfer
Move $40 from account b to account a?,transfer
Put $40 from account a to b?,transfer
Take $40 from account a and transfer it to account b?,transfer
I need to transfer from this account to that one?,transfer
Need to transfer from one account to my other one?,transfer
I would like to transfer from one account to my second one?,transfer
I need to transfer from one account to my second one?,transfer
I have to transfer from one account to my other one?,transfer
Send fifty dollars from me to carrie?,transfer
Transfer sixty dollars to dad from my biggest accnt?,transfer
Send over a hundred dollars from huntington into saving?,transfer
Move 57 dollars from saving into mom?,transfer
Transfer two hundred dollars between my portfolio and my money market account?,transfer
I need to transfer ten dollars from my bank of america account to my capital one account?,transfer
Go ahead and send ten dollars from bank of america to capital one?,transfer
I must transfer ten dollars from my bank of america account to my capital one account?,transfer
I got to transfer ten dollars from my bank of america account to my capital one account?,transfer
I want you to send ten dollars from bank of america to capital one?,transfer
I need you to send ten dollars from bank of america to capital one?,transfer
I have to transfer ten dollars from my bank of america account to my capital one account?,transfer
Send ten dollars from bank of america to capital one?,transfer
Please send ten dollars from bank of america to capital one?,transfer
Make a transfer of $200 from my savings account to my checking account?,transfer
Please transfer $250 from checking to savings?,transfer
Transfer $500 from my checking to my savings?,transfer
Please transfer $100 from my checking to my savings account?,transfer
Transfer $500 from my money market savings account to my checking account?,transfer
Send money from one account to another?,transfer
Transfer 200 dollars from paypal to savings?,transfer
Transfer $10 from checking to savings?,transfer
Send $100 from paypal to my bank?,transfer
Please transfer 100 dollars between my amazon payments and savings accounts?,transfer
I would like to make a transfer?,transfer
I want to transfer funds between accounts?,transfer
Send over 50 dollars between my shared and not shared accounts?,transfer
Whats the quickest way to money from one account to another?,transfer
What is the process to move money from one account to another?,transfer
I need you to send 500 dollars from my high tier account to my regular checking account?,transfer
Can you transfer money from a to b?,transfer
Send my money between accounts?,transfer
How can i send money from one account to another?,transfer
I need to move money from one account to another?,transfer
Send $20 from debit to steve's account?,transfer
Send 20 dollars from savings to checking?,transfer
Please transfer my funds?,transfer
Please transfer $50 to my checking account from credit?,transfer
Go ahead and move $200 from amazon to my bank account?,transfer
Help me move my money?,transfer
I need my money to be moved?,transfer
Help me move my money please?,transfer
I need to move my money?,transfer
Move my money please?,transfer
I would like to transfer $5 from savings to checking?,transfer
Transfer $5 from savings to checking?,transfer
Can you transfer $5 from savings to checking?,transfer
Send $5 from savings to checking?,transfer
Please transfer $5 from savings to checking?,transfer
Please switch $s checking to mortage?,transfer
Please transfer $s from saving to checking?,transfer
Could you transfer $x from saving to checking?,transfer
Help me transfer $x from credit to debit?,transfer
Please transfer $x from checking to saving?,transfer
Transfer money to another account?,transfer
Requesting money transfer between accounts?,transfer
Transfer money from this account to that account?,transfer
Can you transfer money from my account?,transfer
Money transfer request?,transfer
Send 100 dollars from checking to savings?,transfer
Transfer 100 dollars checking to savings?,transfer
Transfer 100 dollars between checking and savings?,transfer
Take 100 dollars from checking and send it to savings?,transfer
Move 100 dollars from checking to savings?,transfer
Can we wire some money over to the other account i have?,transfer
Time to move some cash from one account to another?,transfer
I need to throw some money into that other account?,transfer
Let's send some money to another account?,transfer
I want to initiate a transfer from one account to the other?,transfer
Transfer money from one place to another?,transfer
Move money from one account to another?,transfer
Transfer between two accounts?,transfer
Make a transfer between accounts?,transfer
Send money to another account?,transfer
I need ten dollars sent from b of a to washington mutual?,transfer
Transfer fifty dollars between my chase and bank of america account?,transfer
Deposit ten bucks from my chase account to my ally account?,transfer
Put a hundred dollars in my ally account from bluebird?,transfer
I want seventy bucks transferred from b of a to chase?,transfer
Can i initiate a one-time transfer from my savings account to my money market account?,transfer
Please set a 4 minute timer?,timer
Please set a timer for 6 minutes?,timer
Set a timer for 5 minutes?,timer
I need a 7 minute timer?,timer
I need to set the timer for two minutes?,timer
Can you set a timer for me for fifteen minutes starting now?,timer
Start the timer now and stop at thirty minutes?,timer
I would like you to set the timer to go off in ten minutes?,timer
Please set a timer for 40 minutes?,timer
Wake me in an hour?,timer
Please set a timer for cookies?,timer
I want a timer set?,timer
Remind me in (x) hours?,timer
Set timer for (x) minutes?,timer
I gotta have a 10 minute timer?,timer
Please set a timer for me?,timer
I need a 10 minute timer?,timer
I wish to have a 10 minute timer?,timer
I really need to set a timer?,timer
Set a new timer for ten seconds?,timer
Set a timer for me?,timer
I want a 10 minute timer?,timer
I gotta set a timer?,timer
Set a 10 minute timer?,timer
Set a brand new timer for eight seconds?,timer
Set a ten second timer?,timer
I must set a timer?,timer
Set a timer for twelve seconds?,timer
Set a timer for fifteen seconds?,timer
Tell me when two minutes are up?,timer
Start a timer for two minutes?,timer
Set a timer for two minutes?,timer
Start counting down from two minutes?,timer
Can you set a timer for two minutes?,timer
"""please set 5 minute timer?",timer
Can u please set the timer for 5 minutes?,timer
Set timer of 5 minutes?,timer
"""can u set a timer for 5 minutes?",timer
Set a one hour timer?,timer
Please set a timer for 20 minutes?,timer
Set a five minute timer please?,timer
Set a timer for two hours?,timer
Can you set a two hour timer?,timer
Set the timer for me please?,timer
You need to set the timer for me?,timer
I need you to set timer for me?,timer
Please set the timer for me?,timer
I would like a timer set?,timer
Can you set a timer?,timer
I need you to set a time?,timer
I need a timer set for 15 minutes?,timer
Start a countdown for 20 minutes?,timer
Set a timer for 15 minutes?,timer
I'll need you to set a timer for 10 minutes?,timer
Let's get a timer set for 5 minutes?,timer
Set a timer for 35 minutes?,timer
Please start counting down from 10 minutes?,timer
Let's get a timer going for 10 minutes?,timer
I need a timer for 20 seconds?,timer
Timer 5 minutes?,timer
Alert me in 20 minutes?,timer
Give me a 10 minute countdown?,timer
Let me know in 15 minutes please?,timer
"I'm cooking an egg, timer for 3 mins?",timer
10 minute timer?,timer
Start a timer for 10 minutes?,timer
Timer 10 minutes?,timer
Count down 10 minutes?,timer
Make up a timer for me?,timer
Create a timer for me?,timer
Can you set a timer for me?,timer
I need to set a timer?,timer
Set up a timer?,timer
Could you start a timer for me?,timer
Lets set a timer for me?,timer
Please run a timer for me?,timer
Set a one minute timer?,timer
Set a five minute timer?,timer
Set a seven minute timer?,timer
Start a timer for me?,timer
Set a four minute timer?,timer
Set a six minute timer?,timer
How do i set a timer?,timer
I want a timer for 5 minutes?,timer
Timer for 5 minutes?,timer
Set a timer to go off in 5 minutes?,timer
Set timer for 5 minutes?,timer
I want to set a timer?,timer
Make a timer for 5 minutes?,timer
Please set a timer for?,timer
Remind me that time is up in sixty minutes?,timer
Set an alarm for nine minutes from now?,timer
Tell me when ninety minutes have passed?,timer
Please set timer for 4 pm?,timer
Want 5 minute timer?,timer
Set 30 minute timer?,timer
Get a 3 minute timer?,timer
"Please, can you set the timer for me?",timer
Can you please the timer?,timer
Will you set the timer?,timer
What is the meaning of realism?,definition
What is regard mean?,definition
What is the meaning of interorganizational?,definition
What is it is all relative mean?,definition
What is intercontinental mean?,definition
What is the meaning of supercede?,definition
What is let it be mean?,definition
What is the definition of incomprehensible?,definition
What is the meaning of stupendous?,definition
What is the definition of intelligent?,definition
What is good riddance mean?,definition
What is break a leg mean?,definition
What is the meaning of hyperactive?,definition
What is the definition of valor?,definition
What is stupedous meant?,definition
Find the meaning of qat?,definition
What the heck is qat?,definition
Define qat for me?,definition
Read me a definition for qat?,definition
Look up qat please?,definition
What might the meaning of altruism be?,definition
Exactly what does altruism mean?,definition
What does altruism mean?,definition
What is the definition of altruism?,definition
What is the meaning of altruism?,definition
Affiliate's definition is what?,definition
The definition of affiliate is?,definition
What's the meaning of affiliate?,definition
What's affiliate definition?,definition
Definition of affiliate is what?,definition
Whats the definition of poor?,definition
"Describe the meaning of ""dog?",definition
"What does ""money"" mean?",definition
Tell me what the word die means?,definition
What is the definition of succumb?,definition
What is the meaning of telepathy?,definition
What does tertiary mean?,definition
Tell me the definition of the word redemption?,definition
What is the meaning of the word lux?,definition
What is an ataraxy?,definition
What does the word ataraxy mean?,definition
What does ataraxy mean?,definition
Use the word ataraxy in a sentence?,definition
Define ataraxy?,definition
What does discretionary mean?,definition
Define discretionary?,definition
I want to know the definition of discretionary?,definition
Can you give the definition of deiscretionary?,definition
Let's hear the definition of iridium?,definition
What's the definition of analogy?,definition
Can you tell me the definition of sucrose?,definition
Definition of anachronism?,definition
What's the definition of patriarchy?,definition
Can you tell me the definition of yttrbium?,definition
Please share the definition of episcopalian?,definition
What does saffron mean?,definition
Define sonogram?,definition
Define thoroughbred?,definition
What's the meaning of a fortnight?,definition
What is an anachronism?,definition
What's the meaning of emulsify?,definition
Tell me what cyst means?,definition
What is the definition of flange?,definition
Tell me what flange means?,definition
Define flange?,definition
Flange means what?,definition
What is the meaning of flange?,definition
"What does ""rescind"" mean?",definition
"What is the meaning of word ""rescind?",definition
"Is ""rescind"" a word of positive connotation?",definition
"Where i can use word ""rescind?",definition
Read me the definition of ajar?,definition
What does ajar mean?,definition
Can you show me the dictionary definition of ajar?,definition
Tell me what monstrosity means?,definition
Give me the definition of ajar?,definition
What is the definition of didactic?,definition
I need to know what adumbrate means can you look it up for me now?,definition
I want to know what the word discomfit means?,definition
Find what the word diaphanous mean please?,definition
Do you know what calumny means  please look it up for me?,definition
Find out what the word abrogate means for me?,definition
Tell me what edict means?,definition
What does the word abjure mean?,definition
Can you tell me what dirge means?,definition
Tell me what the word arboreal means?,definition
Whats the definition of transmute?,definition
What is the meaning of the word slander?,definition
What is meant by defense?,definition
Tell me what the word bounty means?,definition
What does deceive mean?,definition
Define zesty?,definition
Look up zesty in dictionary?,definition
Definition of zesty?,definition
What is the definition of zesty?,definition
What does zesty mean?,definition
Tell me what alternative means?,definition
What does alternative mean?,definition
Give me the meaning of alternative?,definition
Tell me the meaning of alternative?,definition
Does life have meaning?,meaning_of_life
Is being alive the meaning of life?,meaning_of_life
What is the real meaning of life?,meaning_of_life
What is the answer to the meaning of life?,meaning_of_life
Is there really an answer to the meaning of life?,meaning_of_life
Does life have a meaning?,meaning_of_life
Who can tell me if there's any meaning to life?,meaning_of_life
What makes life have any meaning?,meaning_of_life
Why do you think we're here?,meaning_of_life
What's the answer to existence?,meaning_of_life
What's the point of sentience?,meaning_of_life
What's the purpose of existence?,meaning_of_life
What's the purpose of life?,meaning_of_life
What's the point of this dumpster fire known as life?,meaning_of_life
What is life's meaning?,meaning_of_life
Is there a greater purpose in life?,meaning_of_life
What is our purpose in life?,meaning_of_life
How is life in existence?,meaning_of_life
What's lifes meaning?,meaning_of_life
What exactly is the meaning of life?,meaning_of_life
Whats lifes meaning exactly?,meaning_of_life
What's the meaning of this life?,meaning_of_life
What is the meaning of life here?,meaning_of_life
Does my life have meaning?,meaning_of_life
I wish to know the meaning of life?,meaning_of_life
I wanna know the meaning of life?,meaning_of_life
I wanna know the point of life?,meaning_of_life
I need to know the point of life?,meaning_of_life
I must know the point of life?,meaning_of_life
Tell the meaning of life?,meaning_of_life
I gotta know the meaning of life?,meaning_of_life
What is your take on the meaning of life?,meaning_of_life
Tell me what is the purpose of life?,meaning_of_life
What meaning does life hold?,meaning_of_life
What do you think is the meaning of like?,meaning_of_life
How do i find the meaning of life?,meaning_of_life
What is the purpose of exsistance?,meaning_of_life
What is your version on the meaning of life?,meaning_of_life
What is your explanation for the meaning of life?,meaning_of_life
What is the purpose of creation?,meaning_of_life
Can you figure out the meaning of life?,meaning_of_life
Whats your take on the meaning of life?,meaning_of_life
Can you explain the meaning of life to me?,meaning_of_life
What is life all about?,meaning_of_life
Can you explain the meaning of life?,meaning_of_life
"What's the point of life, anyways?",meaning_of_life
The meaning of life please?,meaning_of_life
The meaning of life?,meaning_of_life
I'd like to me told the meaning of life?,meaning_of_life
Do you know the meaning of life?,meaning_of_life
Say what the meaning of life is?,meaning_of_life
Can you tell me life's meaning?,meaning_of_life
What's the meaning of my life?,meaning_of_life
What is the underlying purpose to life?,meaning_of_life
What do you think about the meaning of life?,meaning_of_life
What is life’s meaning?,meaning_of_life
Help me figure out the meaning of life?,meaning_of_life
"Would you tell me the meaning of life, please?",meaning_of_life
"Could you tell me the meaning of life, please?",meaning_of_life
Can you tell me the meaning of life?,meaning_of_life
Could you tell me the meaning of life?,meaning_of_life
"Can you tell me the meaning of life, please?",meaning_of_life
What does life mean to you?,meaning_of_life
Is there really a meaning of life?,meaning_of_life
Is there any meaning to being alive?,meaning_of_life
What is the meaning of my life?,meaning_of_life
What is the point of life?,meaning_of_life
What's the point of everything?,meaning_of_life
Is there a meaning to life?,meaning_of_life
Why are we here in life?,meaning_of_life
Can you share the meaning of life?,meaning_of_life
Research the meaning of life?,meaning_of_life
Can you tell me what you think the meaning of life is?,meaning_of_life
What is our purpose here on earth?,meaning_of_life
Is love the meaning of life?,meaning_of_life
Is there a reason people exist?,meaning_of_life
What is the secret or meaning to life?,meaning_of_life
What does life mean on a deeper level?,meaning_of_life
How would you put what life is all about?,meaning_of_life
How would you describe what life means?,meaning_of_life
What do people say life means or the meaning is?,meaning_of_life
Life has what meaning or what's the secret to it?,meaning_of_life
Where is there meaning in life?,meaning_of_life
What is the meaning of this life?,meaning_of_life
Do you know what the meaning of life is?,meaning_of_life
What's life's meaning?,meaning_of_life
"Does life have a meaning, according to you?",meaning_of_life
Does this life have a meaning?,meaning_of_life
Can you share with me your interpretation of the meaning of life?,meaning_of_life
What do you think is the meaning of life?,meaning_of_life
Is there a meaning in life?,meaning_of_life
I wonder if you can explain the meaning of life?,meaning_of_life
"I always wonder about the meaning of life, can you tell me?",meaning_of_life
What's my meaning in life?,meaning_of_life
Define the meaning of life?,meaning_of_life
Meaning of life is?,meaning_of_life
What is your perception of the meaning of life?,meaning_of_life
Whats the meaning of life?,meaning_of_life
What do you think the meaning of life is?,meaning_of_life
What is behind life's meaning?,meaning_of_life
How to create a new aaa insurance plan?,insurance_change
Website to start aaa new insurance plan?,insurance_change
Aaa insurance start new plan?,insurance_change
I want to start a new aaa insurance plan?,insurance_change
Is new this a good insurance plan for me?,insurance_change
What do i do to get new insurance?,insurance_change
New insurance is obtainable how?,insurance_change
How is new insurance gotten?,insurance_change
What do i do for new insurance?,insurance_change
"How do i get new insurance, please?",insurance_change
How can i obtain new insurance?,insurance_change
"How can i obtain new insurance, please?",insurance_change
"How can i get new insurance, please?",insurance_change
How do i make my insurance policy different?,insurance_change
How do i change my insurance policy?,insurance_change
How do i modify my insurance policy?,insurance_change
How do i alter my insurance policy?,insurance_change
How do i get different terms on my insurance policy?,insurance_change
Help me change my insurance plan?,insurance_change
I would like a new insurance plan?,insurance_change
Connect me with some new insurance?,insurance_change
